title,cardDescription,description,image,topics,category,topicsInfo1,alt,sequence,topicsInfo,topicsDescription_old,topicsDescription,idThemes
Node.js,"Node.js é um ambiente de execução que permite rodar JavaScript no servidor. Possui uma arquitetura assíncrona e orientada a eventos, oferecendo eficiência para lidar com múltiplas requisições simultâneas.","O **Node.js** foi criado para executar o JavaScript **fora** de um navegador web, ampliando o potencial dessa linguagem para o desenvolvimento de aplicações back-end, APIs e bibliotecas. Ele nos permite criar soluções diversas e completas, funcionando de maneira eficiente e leve em diferentes contextos e dispositivos.

O Node.js **interpreta código JavaScript**, assim como faria um navegador, mas fora do ambiente do browser. Quando executamos um comando em JavaScript, o Node.js faz a conversão do código para **linguagem de máquina**, pronta para ser executada pelo computador. Por isso, ele é conhecido como um JavaScript Runtime, uma plataforma que executa JavaScript diretamente no sistema.

Node.js possibilita a criação de **aplicações web** e **desktop**, interfaces de linha de comando (CLI), chatbots, e é amplamente utilizado em projetos de Internet das Coisas (IoT), além de outras possibilidades que você pode explorar com essa ferramenta. Essa tecnologia é adotada por grandes empresas, como LinkedIn, IBM, Uber, e Netflix, devido à sua leveza, eficiência e multifuncionalidade.
",Node JS - NIVELAMENTO.png (https://cdn.filestackcontent.com/Omen4D1QRJSkjRT1W6Qp)," Internet: Conceitos e fundamentos,Protocolo HTTP,REST API,TypeORM,Migrations,PrismaORM",Nivelamento,"rw1730305190028e89fd1,2025-10-17T19:19:46+00:00,rw17303052691599a76af,rw1730305270222b120a7,rw1730305280757a1a95b,2025-10-17T19:19:46+00:00","Ícone do Node.js(as letras ""JS"" cercadas por um hexágono ao lado do titulo do card (Node.js) com fundo em tons azuis.",8,"rw1730305190028e89fd1,rw1730305252555aab804,rw17303052691599a76af,rw1730305270222b120a7,rw1730305280757a1a95b,rw175068136549736a7ee","Entenda o que é Node.js como ele revolucionou o desenvolvimento web ao permitir a execução de JavaScript no lado do servidor.,  No Node.js o módulo HTTP facilita a criação de servidores que manipulam requisições e respostas  tornando possível desenvolver aplicações web dinâmicas e escaláveis., REST API é uma interface que permite interações entre sistemas usando HTTP.,  Este guia rápido mostra como instalar o TypeORM e configurá-lo com um banco de dados PostgreSQL em um projeto Node.js., As migrations facilitam a criação e manutenção da estrutura do banco de dados ao longo do desenvolvimento., Prisma é um ORM (Object-Relational Mapper) de nova geração que visa simplificar e proteger a interação com bancos de dados.","Entenda o que é Node.js como ele revolucionou o desenvolvimento web ao permitir a execução de JavaScript no lado do servidor., No Node.js o módulo HTTP facilita a criação de servidores que manipulam requisições e respostas  tornando possível desenvolver aplicações web dinâmicas e escaláveis.,REST API é uma interface que permite interações entre sistemas usando HTTP., Este guia rápido mostra como instalar o TypeORM e configurá-lo com um banco de dados PostgreSQL em um projeto Node.js.,As migrations facilitam a criação e manutenção da estrutura do banco de dados ao longo do desenvolvimento.,Prisma é um ORM (Object-Relational Mapper) de nova geração que visa simplificar e proteger a interação com bancos de dados.",rw17302281624589bf88f
React.js,"React é uma biblioteca JavaScript para criar interfaces de usuário de forma eficiente, permitindo a construção de Componentes reutilizáveis e atualizações rápidas na tela com o Virtual DOM.","React é uma biblioteca JavaScript desenvolvida pelo Facebook para criar interfaces de usuário eficientes e interativas. Sua abordagem declarativa e baseada em Componentes permite construir interfaces de forma modular, onde cada parte da interface é dividida em pequenos ""Componentes"" reutilizáveis. Um dos diferenciais do React é o uso do Virtual DOM, uma representação leve da interface que otimiza o desempenho ao atualizar apenas os elementos necessários, sem recarregar toda a página.
Além disso, React permite combinar lógica de JavaScript com o layout visual por meio do JSX, uma sintaxe que torna o desenvolvimento mais intuitivo. Com a introdução dos ""Hooks"", React simplificou o gerenciamento de estado e efeitos colaterais em Componentes funcionais, tornando-se uma das bibliotecas mais populares para construir aplicações web e móveis escaláveis.",React JS - NIVELAMENTO.png (https://cdn.filestackcontent.com/jVu9VwOpQaeYz3XOalq9),"Componentes,Props,State,Rendering ,One-way Data Flow,Hooks,Refs,React DOM,Router,Axios",Nivelamento,"2025-10-17T19:19:46+00:00,2025-10-17T19:19:46+00:00,2025-10-17T19:19:46+00:00,2025-10-17T19:19:46+00:00,2025-11-06T18:48:27+00:00,2025-10-17T19:19:46+00:00,2025-10-17T19:19:46+00:00,2025-10-17T19:19:46+00:00,2025-10-17T19:19:46+00:00,2025-10-17T19:19:46+00:00",Ícone do React (similar ao desenho de um átomo) ao lado do titulo do card (React.js) com fundo em tons azuis.,9,"rw17303805251492d2538,rw1730380625688dfb8ce,rw1730380736895949100,rw17303807028326d25e2,rw17303806036144fb980,rw173038056720390e1fe,rw173038068290709a104,rw17303806518422c6086,rw1730380721158da9173,rw173038051978684a925","Axios é uma biblioteca JavaScript para fazer requisições HTTP com suporte a Promises permite comunicação entre cliente e servidor simplificando operações com APIs., Um Component em React é como uma função JavaScript que retorna elementos de interface., Aprenda a usar Hooks em React como useState useEffect useParams e useNavigate para tornar seus componentes mais dinâmicos e interativos., O One-way Data Flow em React garante que os dados fluam do componente pai para os filhos tornando o estado mais previsível e o código mais fácil de manter., Props em React.js são fundamentais para criar componentes reutilizáveis e dinâmicos., Explore como o ReactDOM permite a interação eficiente com o DOM em aplicações React Aprenda sobre seus métodos principais e casos de uso para otimizar seu desenvolvimento., Refs no React permitem acessar diretamente elementos do DOM para manipulações fora do ciclo de renderização., Render é o processo em que o React atualiza a interface com base no estado e nas props. Ele acontece inicialmente e sempre que o estado muda., Domine conceitos essenciais como rotas componentes de navegação e rotas aninhadas para criar experiências interativas e fluídas., Entenda o State em React e como ele permite gerenciar dados dinâmicos em suas aplicações.","Um Component em React é como uma função JavaScript que retorna elementos de interface.,Props em React.js são fundamentais para criar componentes reutilizáveis e dinâmicos.,Entenda o State em React e como ele permite gerenciar dados dinâmicos em suas aplicações.,Render é o processo em que o React atualiza a interface com base no estado e nas props. Ele acontece inicialmente e sempre que o estado muda.,O One-way Data Flow em React garante que os dados fluam do componente pai para os filhos tornando o estado mais previsível e o código mais fácil de manter.,Aprenda a usar Hooks em React como useState useEffect useParams e useNavigate para tornar seus componentes mais dinâmicos e interativos.,Refs no React permitem acessar diretamente elementos do DOM para manipulações fora do ciclo de renderização.,Explore como o ReactDOM permite a interação eficiente com o DOM em aplicações React Aprenda sobre seus métodos principais e casos de uso para otimizar seu desenvolvimento.,Domine conceitos essenciais como rotas componentes de navegação e rotas aninhadas para criar experiências interativas e fluídas.,Axios é uma biblioteca JavaScript para fazer requisições HTTP com suporte a Promises permite comunicação entre cliente e servidor simplificando operações com APIs.",rw1730218811141b9a688
Next.js,O Next.js é um framework de desenvolvimento em React que facilita a criação de aplicações web modernas e escaláveis.,"O Next.js é um framework de desenvolvimento para React criado em 2016 pela Vercel, com o objetivo de simplificar a construção de aplicações web modernas e escaláveis. Lançado sob a licença MIT, ele é de código aberto e tem uma comunidade ativa que contribui com melhorias e novas funcionalidades. Esse framework combina flexibilidade e desempenho, permitindo que desenvolvedores criem interfaces otimizadas e com excelente experiência de usuário, aproveitando as capacidades do React com recursos adicionais.

Um dos aspectos mais atraentes do Next.js é seu suporte para renderização híbrida, permitindo tanto renderização no lado do cliente quanto renderização no lado do servidor. Além disso, ele possibilita a Geração de Páginas Estáticas (SSG) e Incremental Static Regeneration (ISR), onde páginas estáticas podem ser atualizadas após a build inicial. Isso é especialmente útil para SEO e desempenho, já que combina a rapidez de sites estáticos com a flexibilidade de conteúdo dinâmico.",Next.js - NIVELAMENTO.png (https://cdn.filestackcontent.com/KIpcZTlFRs6LLKeXcuwZ),"Fundamentos Next.js,Variáveis e Constantes,Funções + Next.js,CSS + Next.js,Componentes + Next.js,Componentes + props,Renderização,Direcionamento de Páginas,Listas",Nivelamento,"rw173022821547674e4af,rw1730305470024733aba,rw173030547906927cbfb,rw1730305490354a90f72,rw17303055001178b3f26,2025-10-17T19:19:46+00:00,rw1730305525617ed167f,rw173030553294685cacb,2025-10-17T19:19:46+00:00","Ícone do next.js (a letra ""N"" envolta por um circulo branco)  ao lado do titulo do card (Next.js) com fundo em tons azuis.",10,"rw173022821547674e4af,rw1730305470024733aba,rw173030547906927cbfb,rw1730305490354a90f72,rw17303055001178b3f26,rw17303055178849abcf2,rw1730305525617ed167f,rw173030553294685cacb,rw1730305540107e95fd7","O Next.js é um framework para criar aplicações web rápidas e escaláveis com React oferecendo renderização server-side e páginas estáticas que melhoram desempenho e SEO., Aprenda a usar variáveis e constantes para armazenar valores e entender seus escopos em React e Next.js., Funções permitem modularizar e reutilizar código executando blocos específicos conforme necessário., Entenda como aplicar estilos em componentes usando CSS e Next.js, Criando componentes reutilizáveis e interface modular flexível., Flexibilizando componentes com props passando propriedades., Renderização condicional em React é uma técnica essencial para exibir ou ocultar componentes com base em condições específicas do código., React Router permite a criação de rotas em aplicações React possibilitando navegação fluida entre componentes sem recarregar a página. Isso facilita a organização e manutenção do código., Neste conteúdo abordamos como criar listas dinâmicas em React com Next.js e TypeScript com foco em preencher um elemento usando dados variáveis.","O Next.js é um framework para criar aplicações web rápidas e escaláveis com React oferecendo renderização server-side e páginas estáticas que melhoram desempenho e SEO.,Aprenda a usar variáveis e constantes para armazenar valores e entender seus escopos em React e Next.js.,Funções permitem modularizar e reutilizar código executando blocos específicos conforme necessário.,Entenda como aplicar estilos em componentes usando CSS e Next.js,Criando componentes reutilizáveis e interface modular flexível.,Flexibilizando componentes com props passando propriedades.,Renderização condicional em React é uma técnica essencial para exibir ou ocultar componentes com base em condições específicas do código.,React Router permite a criação de rotas em aplicações React possibilitando navegação fluida entre componentes sem recarregar a página. Isso facilita a organização e manutenção do código.,Neste conteúdo abordamos como criar listas dinâmicas em React com Next.js e TypeScript com foco em preencher um elemento usando dados variáveis.",rw1730225705921272534
Projetos Fullstack,Um espaço para aplicar habilidades em TypeScript e explorar conceitos aprendidos de forma prática por meio de projetos desafiadores.,"Este tema oferece uma oportunidade para reforçar o aprendizado em TypeScript através de projetos que envolvem o uso de condicionais, arrays e outros conceitos fundamentais. Os exercícios propostos ajudam a resolver problemas reais, promovendo a compreensão e aplicação de lógica de programação, manipulação de dados e boas práticas de desenvolvimento.

A abordagem prática incentiva a exploração de diferentes cenários, a construção de soluções criativas e o desenvolvimento da confiança necessária para enfrentar desafios no mundo da programação. É o espaço ideal para consolidar o aprendizado e avançar no domínio do TypeScript.
",Preparando A Máquina - NIVELAMENTO .png (https://cdn.filestackcontent.com/3IA30CKOScK7LUvKg8ix),"Projeto Pokémon,Projeto Acelera Movies",Nivelamento,"rw1732546252209eee8fb,2025-10-17T19:19:46+00:00",Ícone de uma planilha com engrenagens ao lado do titulo do card (Projetos Fullstack) com fundo em tons azuis.,11,"rw1732546252209eee8fb,rw17326239607377fa730","Explore o mundo Pokémon enquanto aprende habilidades incríveis de front-end e back-end., Este projeto consiste na criação de uma biblioteca de filmes utilizando os templates pré-configurados de repositórios fornecidos pela Aceleradora TW.","Explore o mundo Pokémon enquanto aprende habilidades incríveis de front-end e back-end.,Este projeto consiste na criação de uma biblioteca de filmes utilizando os templates pré-configurados de repositórios fornecidos pela Aceleradora TW.",rw1733155048176679f2e
Testes Unitários com Jest,Aprenda como escrever e executar testes unitários usando o Jest uma das ferramentas de teste mais populares para JavaScript.,"O Jest é uma ferramenta poderosa que facilita a escrita de testes para garantir que o seu código esteja funcionando corretamente. Este módulo irá abordar os conceitos fundamentais dos testes unitários, como configurá-los no Jest, criar mocks e espiar funções, e também fornecerá exemplos práticos para você começar a testar suas aplicações.
",JEST - NIVELAMENTO.png (https://cdn.filestackcontent.com/7FZcEtuOSjat9essw6QS),"Conceitos Básicos de Testes Unitários,Escrevendo Testes Simples com Jest,Testando Funções e Módulos com Jest, Cobertura de Código,Mocking e Espiões,Testando Código com Dependências Externas, Testando Componentes React ,Boas Práticas de Testes",Nivelamento,"rw1732729739182de554a,rw1732729774319f3a701,rw1732734177188ad5703,2025-10-17T19:19:46+00:00,rw17327243381915bac78,rw1732725191266b72448,rw1732725482864a45477,2025-10-17T19:19:46+00:00",Ícone do jest.js (um sapato estilo de palhaço) ao lado do titulo do card (Testes unitários com jest.js) com fundo em tons azuis.,12,"rw1732729739182de554a,rw1732729774319f3a701,rw1732734177188ad5703,rw1732734206416123fc2,rw17327243381915bac78,rw1732725191266b72448,rw1732725482864a45477,rw1732726244691adcd36","Compreenda o que são testes unitários, a importância de garantir a qualidade do código e quando utilizá-los., Aprenda a usar o Jest para criar testes básicos.  , Explore como testar funções e módulos em JavaScript utilizando Jest para garantir que seu código esteja funcionando corretamente., Entenda a importância da cobertura de código e como utilizar ferramentas para medir e melhorar a qualidade dos seus testes., Entenda a importância dos Spies e como usá-los para melhorar seus testes automatizados., Aprenda a testar código que depende de serviços externos, como APIs de terceiros enquanto garante a confiabilidade e a estabilidade dos seus testes., Aprender a testar componentes React utilizando bibliotecas e boas práticas para garantir qualidade e funcionalidade., Boas práticas de testes são essenciais para garantir a qualidade do código e facilitar a manutenção dos sistemas.","Compreenda o que são testes unitários, a importância de garantir a qualidade do código e quando utilizá-los.,Aprenda a usar o Jest para criar testes básicos.  ,Explore como testar funções e módulos em JavaScript utilizando Jest para garantir que seu código esteja funcionando corretamente.,Entenda a importância da cobertura de código e como utilizar ferramentas para medir e melhorar a qualidade dos seus testes.,Entenda a importância dos Spies e como usá-los para melhorar seus testes automatizados.,Aprenda a testar código que depende de serviços externos, como APIs de terceiros enquanto garante a confiabilidade e a estabilidade dos seus testes.,Aprender a testar componentes React utilizando bibliotecas e boas práticas para garantir qualidade e funcionalidade.,Boas práticas de testes são essenciais para garantir a qualidade do código e facilitar a manutenção dos sistemas.",rw17331575209736c7811